{
  "$schema": "https://json-schema.org/draft/2020-12/schema",
  "$id": "https://schemas.maivn.dev/artifacts/artifact_lifecycle_event.schema.json",
  "title": "ArtifactLifecycleEventPayload", "type": "object",
  "properties": {"event_type": {}, "reservation_id": {}, "logical_output_id": {}, "reservation_state": {}, "policy_snapshot_id": {}, "upload_receipt_id": {}, "validation_profile": {}, "validation_receipt_id": {}, "artifact_id": {}, "revision": {}, "custody": {}, "artifact_state": {}, "selection_id": {}, "delivery_id": {}, "destination_ref_id": {}, "delivery_state": {}, "deletion_id": {}, "deletion_receipt_id": {}, "intent_id": {}, "correlation_id": {}, "intent_state": {}, "error": {}},
  "required": ["event_type"],
  "$defs": {
    "id": {"type": "string", "pattern": "^[A-Za-z0-9][A-Za-z0-9_-]{0,127}$"},
    "revision": {"type": "integer", "minimum": 1},
    "custody": {"enum": ["ordinary", "vault_private"]},
    "error": {"$ref": "https://schemas.maivn.dev/artifacts/artifact_error.schema.json"}
  },
  "allOf": [
    {"if":{"properties":{"event_type":{"const":"artifact.reserved"}}},"then":{"additionalProperties":false,"required":["event_type","reservation_id","logical_output_id","reservation_state","policy_snapshot_id"],"properties":{"event_type":{"const":"artifact.reserved"},"reservation_id":{"$ref":"#/$defs/id"},"logical_output_id":{"$ref":"#/$defs/id"},"reservation_state":{"const":"reserved"},"policy_snapshot_id":{"$ref":"#/$defs/id"}}}},
    {"if":{"properties":{"event_type":{"const":"artifact.uploaded"}}},"then":{"additionalProperties":false,"required":["event_type","reservation_id","logical_output_id","reservation_state","upload_receipt_id"],"properties":{"event_type":{"const":"artifact.uploaded"},"reservation_id":{"$ref":"#/$defs/id"},"logical_output_id":{"$ref":"#/$defs/id"},"reservation_state":{"const":"uploading"},"upload_receipt_id":{"$ref":"#/$defs/id"}}}},
    {"if":{"properties":{"event_type":{"const":"artifact.validation_started"}}},"then":{"additionalProperties":false,"required":["event_type","reservation_id","logical_output_id","reservation_state","validation_profile"],"properties":{"event_type":{"const":"artifact.validation_started"},"reservation_id":{"$ref":"#/$defs/id"},"logical_output_id":{"$ref":"#/$defs/id"},"reservation_state":{"const":"validating"},"validation_profile":{"$ref":"#/$defs/id"}}}},
    {"if":{"properties":{"event_type":{"const":"artifact.validated"}}},"then":{"additionalProperties":false,"required":["event_type","reservation_id","logical_output_id","reservation_state","validation_receipt_id"],"properties":{"event_type":{"const":"artifact.validated"},"reservation_id":{"$ref":"#/$defs/id"},"logical_output_id":{"$ref":"#/$defs/id"},"reservation_state":{"const":"validating"},"validation_receipt_id":{"$ref":"#/$defs/id"}}}},
    {"if":{"properties":{"event_type":{"const":"artifact.available"}}},"then":{"additionalProperties":false,"required":["event_type","artifact_id","logical_output_id","revision","custody","artifact_state"],"properties":{"event_type":{"const":"artifact.available"},"artifact_id":{"$ref":"#/$defs/id"},"logical_output_id":{"$ref":"#/$defs/id"},"revision":{"$ref":"#/$defs/revision"},"custody":{"$ref":"#/$defs/custody"},"artifact_state":{"enum":["available","available_in_vault"]}},"allOf":[{"if":{"properties":{"custody":{"const":"ordinary"}}},"then":{"properties":{"artifact_state":{"const":"available"}}}},{"if":{"properties":{"custody":{"const":"vault_private"}}},"then":{"properties":{"artifact_state":{"const":"available_in_vault"}}}}]}},
    {"if":{"properties":{"event_type":{"enum":["artifact.rejected","artifact.failed"]}}},"then":{"additionalProperties":false,"required":["event_type","reservation_id","logical_output_id","reservation_state","error"],"properties":{"event_type":{"enum":["artifact.rejected","artifact.failed"]},"reservation_id":{"$ref":"#/$defs/id"},"logical_output_id":{"$ref":"#/$defs/id"},"reservation_state":{"enum":["rejected","failed"]},"error":{"$ref":"#/$defs/error"}},"allOf":[{"if":{"properties":{"event_type":{"const":"artifact.rejected"}}},"then":{"properties":{"reservation_state":{"const":"rejected"}}}},{"if":{"properties":{"event_type":{"const":"artifact.failed"}}},"then":{"properties":{"reservation_state":{"const":"failed"}}}}]}},
    {"if":{"properties":{"event_type":{"const":"artifact.selected"}}},"then":{"additionalProperties":false,"required":["event_type","selection_id","artifact_id","logical_output_id","revision","custody"],"properties":{"event_type":{"const":"artifact.selected"},"selection_id":{"$ref":"#/$defs/id"},"artifact_id":{"$ref":"#/$defs/id"},"logical_output_id":{"$ref":"#/$defs/id"},"revision":{"$ref":"#/$defs/revision"},"custody":{"$ref":"#/$defs/custody"}}}},
    {"if":{"properties":{"event_type":{"enum":["artifact.delivery_queued","artifact.delivery_started","artifact.delivery_succeeded","artifact.delivery_failed"]}}},"then":{"additionalProperties":false,"required":["event_type","delivery_id","destination_ref_id","artifact_id","logical_output_id","revision","custody","delivery_state"],"properties":{"event_type":{"enum":["artifact.delivery_queued","artifact.delivery_started","artifact.delivery_succeeded","artifact.delivery_failed"]},"delivery_id":{"$ref":"#/$defs/id"},"destination_ref_id":{"$ref":"#/$defs/id"},"artifact_id":{"$ref":"#/$defs/id"},"logical_output_id":{"$ref":"#/$defs/id"},"revision":{"$ref":"#/$defs/revision"},"custody":{"$ref":"#/$defs/custody"},"delivery_state":{"enum":["queued","started","succeeded","failed"]},"error":{"$ref":"#/$defs/error"}},"allOf":[{"if":{"properties":{"event_type":{"const":"artifact.delivery_failed"}}},"then":{"required":["error"],"properties":{"delivery_state":{"const":"failed"}}}},{"if":{"properties":{"event_type":{"enum":["artifact.delivery_queued","artifact.delivery_started","artifact.delivery_succeeded"]}}},"then":{"not":{"required":["error"]}}}]}},
    {"if":{"properties":{"event_type":{"const":"artifact.delivery_queued"}}},"then":{"properties":{"delivery_state":{"const":"queued"}}}},{"if":{"properties":{"event_type":{"const":"artifact.delivery_started"}}},"then":{"properties":{"delivery_state":{"const":"started"}}}},{"if":{"properties":{"event_type":{"const":"artifact.delivery_succeeded"}}},"then":{"properties":{"delivery_state":{"const":"succeeded"}}}},
    {"if":{"properties":{"event_type":{"const":"artifact.expired"}}},"then":{"additionalProperties":false,"required":["event_type","artifact_id","logical_output_id","revision","custody","artifact_state"],"properties":{"event_type":{"const":"artifact.expired"},"artifact_id":{"$ref":"#/$defs/id"},"logical_output_id":{"$ref":"#/$defs/id"},"revision":{"$ref":"#/$defs/revision"},"custody":{"$ref":"#/$defs/custody"},"artifact_state":{"const":"expired"}}}},
    {"if":{"properties":{"event_type":{"enum":["artifact.deletion_requested","artifact.deletion_started"]}}},"then":{"additionalProperties":false,"required":["event_type","deletion_id","artifact_id","logical_output_id","revision","custody","artifact_state"],"properties":{"event_type":{"enum":["artifact.deletion_requested","artifact.deletion_started"]},"deletion_id":{"$ref":"#/$defs/id"},"artifact_id":{"$ref":"#/$defs/id"},"logical_output_id":{"$ref":"#/$defs/id"},"revision":{"$ref":"#/$defs/revision"},"custody":{"$ref":"#/$defs/custody"},"artifact_state":{"const":"deleting"}}}},
    {"if":{"properties":{"event_type":{"const":"artifact.deletion_pending_backup_expiry"}}},"then":{"additionalProperties":false,"required":["event_type","deletion_id","artifact_id","logical_output_id","revision","custody","artifact_state","deletion_receipt_id"],"properties":{"event_type":{"const":"artifact.deletion_pending_backup_expiry"},"deletion_id":{"$ref":"#/$defs/id"},"artifact_id":{"$ref":"#/$defs/id"},"logical_output_id":{"$ref":"#/$defs/id"},"revision":{"$ref":"#/$defs/revision"},"custody":{"const":"vault_private"},"artifact_state":{"const":"deletion_pending_backup_expiry"},"deletion_receipt_id":{"$ref":"#/$defs/id"}}}},
    {"if":{"properties":{"event_type":{"const":"artifact.deleted"}}},"then":{"additionalProperties":false,"required":["event_type","deletion_id","artifact_id","logical_output_id","revision","custody","artifact_state","deletion_receipt_id"],"properties":{"event_type":{"const":"artifact.deleted"},"deletion_id":{"$ref":"#/$defs/id"},"artifact_id":{"$ref":"#/$defs/id"},"logical_output_id":{"$ref":"#/$defs/id"},"revision":{"$ref":"#/$defs/revision"},"custody":{"$ref":"#/$defs/custody"},"artifact_state":{"const":"deleted"},"deletion_receipt_id":{"$ref":"#/$defs/id"}}}},
    {"if":{"properties":{"event_type":{"const":"artifact.delete_incomplete"}}},"then":{"additionalProperties":false,"required":["event_type","deletion_id","artifact_id","logical_output_id","revision","custody","artifact_state","deletion_receipt_id","error"],"properties":{"event_type":{"const":"artifact.delete_incomplete"},"deletion_id":{"$ref":"#/$defs/id"},"artifact_id":{"$ref":"#/$defs/id"},"logical_output_id":{"$ref":"#/$defs/id"},"revision":{"$ref":"#/$defs/revision"},"custody":{"$ref":"#/$defs/custody"},"artifact_state":{"const":"delete_incomplete"},"deletion_receipt_id":{"$ref":"#/$defs/id"},"error":{"$ref":"#/$defs/error"}}}},
    {"if":{"properties":{"event_type":{"enum":["artifact.vault_authorization_pending","artifact.vault_authorization_denied","artifact.vault_render_started","artifact.vault_render_failed"]}}},"then":{"additionalProperties":false,"required":["event_type","intent_id","correlation_id","intent_state"],"properties":{"event_type":{"enum":["artifact.vault_authorization_pending","artifact.vault_authorization_denied","artifact.vault_render_started","artifact.vault_render_failed"]},"intent_id":{"$ref":"#/$defs/id"},"correlation_id":{"$ref":"#/$defs/id"},"intent_state":{"enum":["authorization_pending","authorization_denied","rendering_in_vault","render_failed"]},"error":{"$ref":"#/$defs/error"}},"allOf":[{"if":{"properties":{"event_type":{"const":"artifact.vault_authorization_pending"}}},"then":{"properties":{"intent_state":{"const":"authorization_pending"}},"not":{"required":["error"]}}},{"if":{"properties":{"event_type":{"const":"artifact.vault_authorization_denied"}}},"then":{"properties":{"intent_state":{"const":"authorization_denied"}},"required":["error"]}},{"if":{"properties":{"event_type":{"const":"artifact.vault_render_started"}}},"then":{"properties":{"intent_state":{"const":"rendering_in_vault"}},"not":{"required":["error"]}}},{"if":{"properties":{"event_type":{"const":"artifact.vault_render_failed"}}},"then":{"properties":{"intent_state":{"const":"render_failed"}},"required":["error"]}}]}}
  ],
  "oneOf": [
    {"properties":{"event_type":{"const":"artifact.reserved"}}},{"properties":{"event_type":{"const":"artifact.uploaded"}}},{"properties":{"event_type":{"const":"artifact.validation_started"}}},{"properties":{"event_type":{"const":"artifact.validated"}}},{"properties":{"event_type":{"const":"artifact.available"}}},{"properties":{"event_type":{"const":"artifact.rejected"}}},{"properties":{"event_type":{"const":"artifact.failed"}}},{"properties":{"event_type":{"const":"artifact.selected"}}},{"properties":{"event_type":{"const":"artifact.delivery_queued"}}},{"properties":{"event_type":{"const":"artifact.delivery_started"}}},{"properties":{"event_type":{"const":"artifact.delivery_succeeded"}}},{"properties":{"event_type":{"const":"artifact.delivery_failed"}}},{"properties":{"event_type":{"const":"artifact.expired"}}},{"properties":{"event_type":{"const":"artifact.deletion_requested"}}},{"properties":{"event_type":{"const":"artifact.deletion_started"}}},{"properties":{"event_type":{"const":"artifact.deletion_pending_backup_expiry"}}},{"properties":{"event_type":{"const":"artifact.deleted"}}},{"properties":{"event_type":{"const":"artifact.delete_incomplete"}}},{"properties":{"event_type":{"const":"artifact.vault_authorization_pending"}}},{"properties":{"event_type":{"const":"artifact.vault_authorization_denied"}}},{"properties":{"event_type":{"const":"artifact.vault_render_started"}}},{"properties":{"event_type":{"const":"artifact.vault_render_failed"}}}
  ]
}
