[
  {"event_type":"artifact.reserved","reservation_id":"reservation-001","logical_output_id":"output-001","reservation_state":"reserved","policy_snapshot_id":"policy-001"},
  {"event_type":"artifact.uploaded","reservation_id":"reservation-001","logical_output_id":"output-001","reservation_state":"uploading","upload_receipt_id":"upload-receipt-001"},
  {"event_type":"artifact.validation_started","reservation_id":"reservation-001","logical_output_id":"output-001","reservation_state":"validating","validation_profile":"document-default"},
  {"event_type":"artifact.validated","reservation_id":"reservation-001","logical_output_id":"output-001","reservation_state":"validating","validation_receipt_id":"validation-receipt-001"},
  {"event_type":"artifact.available","artifact_id":"artifact-001","logical_output_id":"output-001","revision":1,"custody":"ordinary","artifact_state":"available"},
  {"event_type":"artifact.rejected","reservation_id":"reservation-001","logical_output_id":"output-001","reservation_state":"rejected","error":{"code":"artifact_validation_failed","error_class":"validation","retryable":false}},
  {"event_type":"artifact.failed","reservation_id":"reservation-001","logical_output_id":"output-001","reservation_state":"failed","error":{"code":"artifact_validation_failed","error_class":"validation","retryable":false}},
  {"event_type":"artifact.selected","selection_id":"selection-001","artifact_id":"artifact-001","logical_output_id":"output-001","revision":1,"custody":"ordinary"},
  {"event_type":"artifact.delivery_queued","delivery_id":"delivery-001","destination_ref_id":"destination-001","artifact_id":"artifact-001","logical_output_id":"output-001","revision":1,"custody":"ordinary","delivery_state":"queued"},
  {"event_type":"artifact.delivery_started","delivery_id":"delivery-001","destination_ref_id":"destination-001","artifact_id":"artifact-001","logical_output_id":"output-001","revision":1,"custody":"ordinary","delivery_state":"started"},
  {"event_type":"artifact.delivery_succeeded","delivery_id":"delivery-001","destination_ref_id":"destination-001","artifact_id":"artifact-001","logical_output_id":"output-001","revision":1,"custody":"ordinary","delivery_state":"succeeded"},
  {"event_type":"artifact.delivery_failed","delivery_id":"delivery-001","destination_ref_id":"destination-001","artifact_id":"artifact-001","logical_output_id":"output-001","revision":1,"custody":"ordinary","delivery_state":"failed","error":{"code":"artifact_storage_unavailable","error_class":"availability","retryable":true}},
  {"event_type":"artifact.expired","artifact_id":"artifact-001","logical_output_id":"output-001","revision":1,"custody":"ordinary","artifact_state":"expired"},
  {"event_type":"artifact.deletion_requested","deletion_id":"deletion-001","artifact_id":"artifact-001","logical_output_id":"output-001","revision":1,"custody":"ordinary","artifact_state":"deleting"},
  {"event_type":"artifact.deletion_started","deletion_id":"deletion-001","artifact_id":"artifact-001","logical_output_id":"output-001","revision":1,"custody":"ordinary","artifact_state":"deleting"},
  {"event_type":"artifact.deletion_pending_backup_expiry","deletion_id":"deletion-001","artifact_id":"artifact-001","logical_output_id":"output-001","revision":1,"custody":"vault_private","artifact_state":"deletion_pending_backup_expiry","deletion_receipt_id":"deletion-receipt-001"},
  {"event_type":"artifact.deleted","deletion_id":"deletion-001","artifact_id":"artifact-001","logical_output_id":"output-001","revision":1,"custody":"ordinary","artifact_state":"deleted","deletion_receipt_id":"deletion-receipt-001"},
  {"event_type":"artifact.delete_incomplete","deletion_id":"deletion-001","artifact_id":"artifact-001","logical_output_id":"output-001","revision":1,"custody":"ordinary","artifact_state":"delete_incomplete","deletion_receipt_id":"deletion-receipt-001","error":{"code":"artifact_validation_failed","error_class":"validation","retryable":false}},
  {"event_type":"artifact.vault_authorization_pending","intent_id":"intent-001","correlation_id":"correlation-001","intent_state":"authorization_pending"},
  {"event_type":"artifact.vault_authorization_denied","intent_id":"intent-001","correlation_id":"correlation-001","intent_state":"authorization_denied","error":{"code":"vault_authorization_required","error_class":"authorization","retryable":false}},
  {"event_type":"artifact.vault_render_started","intent_id":"intent-001","correlation_id":"correlation-001","intent_state":"rendering_in_vault"},
  {"event_type":"artifact.vault_render_failed","intent_id":"intent-001","correlation_id":"correlation-001","intent_state":"render_failed","error":{"code":"vault_unavailable","error_class":"availability","retryable":true}}
]
